"","current_character","current_dialogue"
"1","                          FITZGERALD","Likely got a splinter. Can't figure what to do without Mama here  to pull it out for him."
"2","                          BOONE","Need a doc, Captain?"
"3","                          HENRY","Gather more wood."
"4","                          FITZGERALD","Shame my Pap was a broken down drunk. Else he could've bought me  a Captain's job too."
"5","                          FITZGERALD ","We got a plan for these fires, Captain, or are we roastin' berries  all the way up to Fort Union?"
"6","                          HENRY","Glass and the others will be back with some game, Fitzgerald. Just  make sure you have the fires ready."
"7","                          FITZGERALD","My supper's in the hands of a hermit nigger, a kid and a dummy.  Hell, my belly feels full already."
"8","           VOICE ","Shit fire, you got him, Mr. Glass!"
"9","                          PIG ","Square as a barn door."
"10","                          PIG ","Right where you said he'd be."
"11","                          BRIDGER","But bigger than we figured. Gonna  be a load to haul back to camp."
"12","                          PIG","Have to split it up I reckon."
"13","                          GLASS","Yep. Bridger'll take the tail, and  Pig you haul the rest."
"14","                          BRIDGER","Another one close by?"
"15","                          PIG","Hugh?"
"16","                          BOONE","No rule says I'm the only one  that's gotta gather this shit."
"17","                          TRAPPER","`REE!"
"18","                          GLASS","GET TO THE BOAT!"
"19","                          GLASS ","THE BOAT, CAPTAIN!"
"20","                          TRAPPER","WAIT!"
"21","                          BRIDGER","Thank you."
"22","           VOICE ","HEY!"
"23","                          FITZGERALD","What's the plan, Captain?"
"24","                          FITZGERALD ","Captain! What the hell do we do  now?"
"25","                          ANDERSON","We're just floatin' farther from  Fort Union."
"26","                          GLASS","The Missouri's no good. Not if the  `Ree's running it."
"27","                          FITZGERALD","So we just float the hell down to Mexico or wherever else this river  takes us?"
"28","                          GLASS","We get ourselves safe outta range,  then track another course up."
"29","                          FITZGERALD","Add weeks to the trip."
"30","                          BRIDGER","Better that than endin' up scalped  on the side of the river."
"31","                          FITZGERALD","Shut up, kid, you don't get no say  in this."
"32","                          FITZGERALD ","And in case you hadn't noticed, Captain, we're twelve men short of what we were. (off the badly wounded TRAPPER)  Thirteen before long."
"33","                          HENRY","I understand our situation, Mr. Fitzgerald. We do like Glass said... put some distance between us and the Arikara, then chart a  course to Fort Union."
"34","                          PIG","Reckon it's better `an lettin' the `Ree find him... take his ears...  slice what's left all to shit."
"35","                          HENRY","So we hike west to the Grand, then  follow it up to Fort Union."
"36","                          FITZGERALD","On foot? You got any idea how long that's gonna take? It'll be winter  before we get there."
"37","                          ANDERSON","Unless we come across a post...  trade for some horses."
"38","                          GLASS","No posts that far out."
"39","                          FITZGERALD","So if we do this, we do every step  with our own feet."
"40","                          HENRY","And gather extra blankets `cause  there won't be any fires."
"41","                          BRIDGER","Thank you... for what you done back  there."
"42","                          GLASS","You'd have done the same for me."
"43","                          FITZGERALD","You treat that Anstadt sweeter than  any woman, Glass."
"44","                          STUBBY BILL","Never seen a woman that could stop  a `Ree from three hundred feet."
"45","                          ANDERSON","I knew a particular big-breasted redhead in Boston that might come  close."
"46","                          FITZGERALD","Bring it over here for me to have a  look."
"47","                          FITZGERALD ","Did you hear what I said, boy?"
"48","                          BRIDGER","You seen it before."
"49","                          FITZGERALD","What'd you say, kid?"
"50","                          BRIDGER","I said you shoulda already got a look when he saved you with it  earlier."
"51","                          FITZGERALD","Else that mighta nicked somethin'."
"52","                          FITZGERALD ","And unlike you, I don't need savin' by him or nobody else. Remember  that."
"53","                          FITZGERALD ","Lemme see what's so special `bout  that shooter of yours."
"54","                          GLASS","Middle of workin' on it."
"55","                          FITZGERALD","Well you can stop workin' on it,  and let me have a look like I said."
"56","                          FITZGERALD ","You forget your place?"
"57","                          GLASS","Best I can tell, my place is right where I want it... on the smart end  of my rifle."
"58","                          FITZGERALD","I'd be careful if I was you, boy."
"59","                          HENRY","If you're passed out when we break  camp tomorrow, I leave you here."
"60","                          FITZGERALD","That's the trouble with this part of the world. No mirrors. Niggers  forget what color they are."
"61","                          HENRY","Can't sleep either?"
"62","                          GLASS","Never like closin' my eyes when I'm not sure who'll be standin' over me  when I open `em."
"63","                          HENRY","I keep thinking about Boone and the others... how maybe I should've had  us make camp further up river."
"64","                          GLASS","You're a good man, Captain. Soon as you realize that, these others  will too."
"65","                          HENRY","Your years trappin' and guidin' out here... have you had much  experience with the Arikara?"
"66","                          GLASS","Enough to try and stay outta their  way."
"67","                          HENRY","But you know this country well enough to get us past them... up to  Fort Union?"
"68","                          GLASS","I been here a long while. Whether  that gets us to Union or not..."
"69","                          HENRY","What Fitzgerald said earlier... he  doesn't speak for the rest."
"70","                          GLASS","He wasn't wrong. Truth is that's what I prefer about this country... it's got no eye for the color of a  man's skin."
"71","                          HENRY","Try to get some sleep, Hugh."
"72","                          STUBBY BILL","Shouldn't we have hit the Grand by  now?"
"73","                          HENRY","We'll reach it soon enough. Glass  said to keep this course."
"74","                          FITZGERALD","Glass said. Too bad I don't see  him."
"75","                          PIG","That's on account he's up ahead makin' sure it's clear, and you get  to keep your ears."
"76","                          FITZGERALD","Or he's run off and left us."
"77","                          BRIDGER","He wouldn't do that."
"78","                          FITZGERALD","My bet, that nigger's used to  runnin'."
"79","                          HENRY","UP AHEAD!"
"80","                          BRIDGER","Christ Almighty."
"81","                          HENRY","Glass!"
"82","                          PIG","HUGH!"
"83","                          BRIDGER","He's down here!"
"84","                          MURPHY","Oh, Jesus."
"85","                          STUBBY BILL","He's tore to pieces."
"86","                          ANDERSON","Least he took that Grizz down with  him."
"87","                          FITZGERALD","Wished he'da done it without firing his rifle. If there wasn't no `Ree  around before, there will be now."
"88","                          HENRY","THAT'S ENOUGH!"
"89","                          BRIDGER","Holy Christ, he's alive."
"90","                          HENRY","Get me some water."
"91","                          BRIDGER","Oh, Jesus... Jesus."
"92","                          HENRY","You're going to be fine."
"93","                          HENRY ","I need some rags before he bleeds  out."
"94","                          HENRY ","And your whiskey."
"95","                          HENRY ","Hold him down, Bridger, goddammit."
"96","                          HENRY ","The rest of you spread out... scout a circle around us. Fitzgerald, you and Anderson take west and north. Murphy and Mike south and east. Watch for anyone that  might've heard that shot."
"97","                          PIG","What about me, Cap?"
"98","                          HENRY","Get down here and help me tie off  these wounds best we can."
"99","                          PIG","It won't stop bleedin'."
"100","                          HENRY","We're fixing you up, Hugh."
"101","                          BRIDGER","It's gonna be fine, Mr. Glass."
"102","                          HENRY","Roll him over... easy."
"103","                          HENRY ","Get me the kit. We need to stitch  his back up."
"104","                          BRIDGER","What about the rest of him?"
"105","                          HENRY","And I don't know what to do with  that yet."
"106","                          HENRY ","I'm sorry for how this is about to  burn, Hugh."
"107","                          ANDERSON","They're torturin' the poor bastard."
"108","                          FITZGERALD","And riskin' gettin' us killed in the process. Proper thing would be  to end it for him quick."
"109","                          ANDERSON","`Less he could pull through."
"110","                          FITZGERALD","You seen what that grizz did to him. Shit, Glass'll be dead inside a hour. We all will be if he keeps  screamin' like that."
"111","                          BRIDGER","What now?"
"112","                          HENRY","We wait. Does he have any kin you  know of?"
"113","                          PIG","He keeps to hisself. Never  mentioned none."
"114","                          HENRY","Go get the others. Tell `em we're  making camp here for the night."
"115","                          HENRY ","And gather some wood, but make sure it's dry. We don't want much smoke  when we cook that grizzly."
"116","           FITZGERALD ","What makes you think you earned a  claw?"
"117","                          FITZGERALD ","You didn't take that grizz down."
"118","                          BRIDGER","It ain't for me."
"119","                          PIG","Whatta you figure his odds are,  Jim?"
"120","                          BRIDGER","Long."
"121","                          MURPHY","What that bear did to him... I  didn't expect he'd last this long."
"122","                          ANDERSON","I seen a fella go a week once after a lion jumped him. Fever finally  finished him off."
"123","                          STUBBY BILL","Whatta we do, Cap?"
"124","                          HENRY","We give him his chance."
"125","                          FITZGERALD","You ain't doin' him or us no favors, Captain, lettin' him suffer  that way."
"126","                          ANDERSON","Fever's hit. Won't be long now."
"127","                          FITZGERALD","I seen a bad one drag on days."
"128","           HENRY ","Quiet, Fitzgerald."
"129","                          FITZGERALD","We keep sittin' here watchin' him die, only gives the `Ree more  chance to find us."
"130","                          BRIDGER","He's burnin', Cap. Water turns to  boil as soon as it touches him."
"131","                          HENRY","Pig, take Anderson and scout ahead. Grand should be just west of here.  Find us the best route."
"132","                          FITZGERALD","Tryin' to buy Glass time don't make  sense for the rest of us, Captain."
"133","                          HENRY","Get movin'."
"134","                          HENRY ","You two can start digging a grave."
"135","                          FITZGERALD","Least it's a step in the right  direction."
"136","                          FITZGERALD","Any coyote digs that deep deserves  the meal."
"137","                          FITZGERALD ","Glass won't know the difference no  ways."
"138","                          PIG","Found it, Cap. Right where Glass  had us headed."
"139","                          ANDERSON","No more than a mile or so out."
"140","                          HENRY","We could build a litter. Haul him  with us."
"141","                          ANDERSON","It's rocky and steep goin'."
"142","                          PIG","Marshy and thick on the other side.  We could try it, but..."
"143","                          FITZGERALD","I signed on as a trapper, not a  goddamn mule."
"144","                          BRIDGER","Shape he's in... I don't see no way  he'd make bein' drug."
"145","                          HENRY","Lay that rag over his eyes, Mr.  Bridger."
"146","                          BRIDGER","But, Captain."
"147","                          HENRY","Do it."
"148","           HENRY ","Step clear, Mr. Bridger."
"149","                          HENRY ","There's a seventy dollar bonus from the Rocky Mountain Fur Company to the two men that stay with Glass... see this through. Then give him a  proper burial."
"150","                          BRIDGER","I'll stay with him... money or not."
"151","                          PIG","Same here."
"152","                          HENRY","I can't let you stay back, Pig. Without Glass, I'll need you to  scout."
"153","                          HENRY ","Just need one more."
"154","                          FITZGERALD","Two won't stand much chance against a party of `Ree, Captain, and seventy dollars won't buy me a new  setta ears."
"155","                          HENRY","A hundred then."
"156","                          BRIDGER","They can have my share too. I owe  Glass that at least."
"157","                          FITZGERALD","That case I'll hang back with the kid. I don't mind fallin' a day or  so behind for two hundred."
"158","                          HENRY","But Glass is to be cared for until.  Understood?"
"159","                          FITZGERALD","I'll let the young doctor do his  job."
"160","                          HENRY","The rest gather your gear."
"161","                          PIG","I'll see ya at Fort Union, Hugh."
"162","                          HENRY","(to Fitzgerald and BRIDGER)  As long as necessary."
"163","                          BRIDGER","I'll look after him."
"164","                          FITZGERALD","I'll take first watch."
"165","                          BRIDGER","Not with his rifle."
"166","                          FITZGERALD","Trust me, kid, he ain't gonna be  needin' it tonight."
"167","                          FITZGERALD","You were right to protect this."
"168","                          FITZGERALD","When are you gonna die, boy?"
"169","                          FITZGERALD ","I'm nearly a week behind Henry's bunch on accounta havin' to tend to you. Be easier on us all if you'd  take that last breath."
"170","                          FITZGERALD ","I could help ya with that if you'd like. Muzzle ya right now... end all this sufferin' quick and easy.  Nobody'd ever know you give up."
"171","                          FITZGERALD ","You just gimme a blink if you want  me to do it."
"172","           BRIDGER ","What's goin' on?"
"173","                          FITZGERALD","Don't you ever question me, you  little piss-ant."
"174","                          FITZGERALD ","But that don't mean I can't be  coaxed into changin' my mind."
"175","                          FITZGERALD ","And I was just doin' your job...  cleanin' him up."
"176","                          FITZGERALD ","I promise ya, you'll look a helluva lot worse than Glass when they're  done with you."
"177","           FITZGERALD ","Bridger! Get your ass up!"
"178","                          FITZGERALD ","`Ree."
"179","                          BRIDGER","What?"
"180","                          FITZGERALD","Keep quiet. I was down at the creek... there's twenty of `em at  least, comin' this way."
"181","                          BRIDGER","Oh, shit. Whatta we do?"
"182","                          FITZGERALD","We run. Now."
"183","                          BRIDGER","What about Glass?"
"184","                          FITZGERALD","He's on his own, same as us."
"185","                          BRIDGER","I can't leave him."
"186","                          FITZGERALD","Then I'm talkin' to a dead man."
"187","                          FITZGERALD ","Move."
"188","                          BRIDGER","What're you doin'? He needs that."
"189","                          FITZGERALD","He couldn't hold it if you tarred  it to his hands."
"190","                          BRIDGER","It's his goddamn rifle! That's all  he's got!"
"191","                          FITZGERALD","And more than he'll need."
"192","                          BRIDGER","We can't leave him with nothin'."
"193","                          FITZGERALD","We ran the better part of six hours. Had to gain some ground on  Henry and them others."
"194","                          BRIDGER","Best douse that smoke before them  `Ree spot it."
"195","                          FITZGERALD","We put enough distance between us and them. And it's too damn cold  to go without one."
"196","                          BRIDGER","All we know, they hoofed it through  the night same as us."
"197","                          FITZGERALD","A dozen `Ree can't make the time us  two did."
"198","                          BRIDGER","It was twenty earlier."
"199","                          FITZGERALD","What?"
"200","                          BRIDGER","When you woke me... you said you'd  spotted twenty `Ree."
"201","                          FITZGERALD","A dozen... twenty. I wasn't in a mood to count feathers. Hell, one  `Ree woulda been too many."
"202","                          BRIDGER","I'd already brought plenty a water."
"203","                          BRIDGER ","Answer me."
"204","                          FITZGERALD","Don't start questionin' me on accounta you feelin' guilty `bout  leavin' your nigger buddy behind."
"205","           ANSWER ME OR I BLOW YOUR DAMN HEAD","OFF!"
"206","                          FITZGERALD","`Cause you was scared shitless,  that's why."
"207","                          BRIDGER","DID YOU SEE `EM?"
"208","                          FITZGERALD","Not a one."
"209","                          FITZGERALD ","So that there is the answer to your  question."
"210","                          FITZGERALD ","And the next time you aim to kill somebody, kid, best remember your  gun won't fire without a flint."
"211","                          BRIDGER","I'm goin' back for him."
"212","                          FITZGERALD","Far as we ran all night, you couldn't find Glass with dogs and a map. And I don't believe you really want to. `Cause after leavin' him to die the first time, I doubt he'd be too happy to see  you now."
"213","                          FITZGERALD ","And just so we're clear. If you try to backtrack without me knowin', or ever get so guilty you  feel the need to tell somebody."
"214","                          FITZGERALD ","I'll have no choice but to gut you  from nuts to nose."
"215","                          FITZGERALD ","Now let's go."
"216","                          SPOTTED HORSE","Griz-lee."
"217","          LEATHER STRAPS SNAPPING AROUND GLASS' WRISTS AND ANKLES...","stretched tight."
"218","                          FITZGERALD","`Bout goddamn time."
"219","                          FITZGERALD ","And we're understood on everything... Glass' dyin' in his sleep... us buryin' him like was  agreed."
"220","                          FITZGERALD ","You're as guilty as me in leavin' him. Don't you forget that. You got a future up here. No sense tossin' it away when he was as good as dead already. Shit, all we did  was skip the funeral."
"221","                          FITZGERALD ","I won't take to givin' up that two- hundred on accounta you gettin'  weak-kneed."
"222","                          FITZGERALD","Twice the folks here than when we  left."
"223","                          BRIDGER","We should go see Captain Henry."
"224","                          FITZGERALD","Far as we hiked... we got time for  a drink on the company's tab."
"225","           PIG ","Jim!"
"226","                          PIG ","You made it! I was scared the `Ree  mighta caught up to ya."
"227","                          FITZGERALD","If your fat ass could get through,  we didn't have no worries."
"228","                          PIG","(off Fitzgerald, to BRIDGER) Had to be a helluva long walk for  you."
"229","                          PIG ","Hugh?"
"230","                          PIG ","Guess we all knowed how it would  turn out. Did he suffer much more?"
"231","                          BRIDGER","I hope not."
"232","                          FITZGERALD","Maybe we best go see Henry, kid. I just got a itch to spend the first  of my two-hundred."
"233","                          FITZGERALD","I won't pretend to been his friend, but I respect any man that fights  the way he done."
"234","                          HENRY","And the grave?"
"235","                          FITZGERALD","We had those extra days so we went deeper... covered it in rocks. To  keep the scavengers off him."
"236","                          HENRY","Any sign of hostiles?"
"237","                          FITZGERALD","Not a one."
"238","                          FITZGERALD ","Truth is, I was worried `bout `Ree, and ready to get movin', but Bridger here argued to stay and  make a cross for the grave."
"239","                          FITZGERALD ","So that's what we did."
"240","                          HENRY","Glad to hear you pulled your weight, Mr. Bridger. I knew you  would."
"241","                          FITZGERALD","More than his share, Captain."
"242","                          HENRY","Speaking of shares."
"243","                          HENRY ","Am I to assume the agreed  arrangement didn't change?"
"244","                          FITZGERALD","Fortunate for me, it did not."
"245","                          HENRY","Well thank you both for your courage and honor. You have done  yourselves proud."
"246","                          HENRY ","You're owed something for what you  did."
"247","                          FITZGERALD","He's beat hisself up most of the  trip... wishin' he'da done more."
"248","                          HENRY","We all saw the shape Glass was in.  There was no more to be done."
"249","                          FITZGERALD","That's what I been tellin' him."
"250","                          GLASS","Thank you."
"251","                          GLASS ","Bad medicine."
"252","                          GLASS ","How long have I been here?"
"253","                          GLASS ","You're Sioux. I only know a bit a  Pawnee."
"254","                          GLASS ","Here. How long?"
"255","                          GLASS","How many suns? Ten?"
"256","                          GLASS ","Ten suns?"
"257","                          GLASS ","Christ."
"258","                          BOYS","Tatanka Wicasa."
"259","           SPOTTED HORSE ","Buff-A-lo Man."
"260","                          GLASS","You speak English."
"261","                          SPOTTED HORSE","Need words when trade with whites."
"262","                          GLASS","Now if you could point me which way it is you do your tradin'... with  the whites."
"263","                          SPOTTED HORSE","Whites. Bra-zo."
"264","                          GLASS","Fort Brazeau? That's where I'm  tryin' to get. Is it far from here?"
"265","                          GLASS ","Far? Long way?"
"266","                          GLASS ","Three days on horse?"
"267","                          SPOTTED HORSE","Not walk. Hides soon."
"268","                          GLASS","The men stole my rifle."
"269","                          GLASS ","They took. They took..."
"270","                          GLASS ","...my rifle. My gear."
"271","                          GLASS ","They left me to die. So I mean to  find `em both. Get my rifle back."
"272","                          SPOTTED HORSE","Red Hawk ask who kill griz-lee."
"273","                          GLASS","Grizzly?"
"274","                          RED HAWK","Arikara."
"275","                          SPOTTED HORSE","He say Arikara take right ear of Sioux. Left ear of whites. Not  know what they take from you."
"276","                          SPOTTED HORSE","Buff-A-lo Man hunt with Sioux?"
"277","                          THREE FEATHERS","Tatanka Wicasa."
"278","                          BOYS","Tatanka Wicasa! Tatanka Wicasa!"
"279","                          GLASS","Thank you."
"280","                          SPOTTED HORSE","Good hunt."
"281","                          GLASS","Yes."
"282","                          SPOTTED HORSE","You. Fam-i-lee?"
"283","                          GLASS","No."
"284","                          SPOTTED HORSE","Wakayaja?"
"285","                          GLASS","No. Not for a long time."
"286","                          GLASS","Tatanka Wicasa."
"287","                          GLASS","Nice."
"288","                          SPOTTED HORSE","Nice."
"289","                          FITZGERALD","No... please."
"290","                          SPOTTED HORSE","We go."
