"","current_character","current_dialogue"
"291","                          BRAZEAU","We make good trades then."
"292","                          BRAZEAU ","Monsieur Glass?"
"293","                          GLASS","Good to see you again, Mr. Brazeau."
"294","                          BRAZEAU","Jesus Christ, what happened to your  goddamned face?"
"295","                          GLASS","Had a tussle with a grizzly."
"296","                          BRAZEAU","And now the grizzly, he don't look  so good either, eh?"
"297","                          BRAZEAU ","You run with the Sioux these days?"
"298","                          GLASS","They looked after me for a spell. I'm on my way to catch back up with Captain Henry... at Fort Union. Needed to trade for some supplies  on the Company's credit if I could."
"299","                          BRAZEAU","Oui, of course. Anything you like."
"300","                          GLASS","We can start with this."
"301","                          BRAZEAU","I wish I could give you a room for  the night, but..."
"302","                          BRAZEAU ","I cannot risk the trouble of  letting a colored stay inside."
"303","                          GLASS","Won't be the last night I sleep on  the ground."
"304","                          BRAZEAU","Take care of that face, Glass."
"305","                          GLASS","You stay here tonight?"
"306","                          SPOTTED HORSE","Your people?"
"307","                          GLASS","No."
"308","                          SPOTTED HORSE","You come then."
"309","                          GLASS","Fort Union."
"310","                          SPOTTED HORSE","You spend your life hunting enemy.  Enemy wins."
"311","                          GLASS","It will be over soon."
"312","                          GLASS ","Thank you."
"313","                          FITZGERALD","I had enough of this cold as hell  shit."
"314","                          ANDERSON","What'd you figure when ya signed on outta that St. Louis whorehouse you was workin'? That you was headin'  off to paradise?"
"315","                          FITZGERALD","I tell ya what I figured, I figured I'd be somewhere the piss wouldn't freeze before I got it outta my  pecker."
"316","                          BRIDGER","Figured wrong."
"317","                          FITZGERALD","Waste a time to check traps in this weather... while Henry sits warmin'  his ass on the stove in his office."
"318","                          STUBBY BILL","Why don't you go tell him that, Fitz? Then start your hike back to  St. Louie."
"319","                          FITZGERALD","Shit, I walked up here, I got no  problem walkin' back."
"320","                          MURPHY","Contracted for twelve months. We  all did."
"321","                          FITZGERALD","Henry can shove that contract up his toasty warm ass, or I'll do it  for him."
"322","                          FITZGERALD ","You don't think I will?"
"323","                          ANDERSON","Just give that fat little whore you're so sweet on a couple extra bits... she'll have you thinkin'  it's Spring already."
"324","                          FITZGERALD","Hello? Captain?"
"325","           MURPHY ","Where're you headed?"
"326","                          FITZGERALD","To the river, Murphy."
"327","                          MURPHY","That you, Fitzgerald?"
"328","                          FITZGERALD","Left my rifle down there... don't  want it out all night."
"329","                          MURPHY","That weren't too smart."
"330","                          FITZGERALD","Just don't take a shot at me when I  come back in."
"331","                          MURPHY","We'll see."
"332","                          FITZGERALD","Not that you'd hit me if you tried."
"333","                          GLASS","(struggling to make his frozen lips move)  I'm Hugh Glass of..."
"334","                          RUNTY MAN","We don't serve niggers."
"335","                          GLASS","Of the Rocky Mountain Fur Company  on my way to Fort Union."
"336","                          RUNTY MAN","I don't care if you was with Lewis and Clark headed for the new world.  We don't serve niggers."
"337","                          GLASS","All I need is a horse and enough  supplies to..."
"338","                          TRAPPER","Ice musta froze up his ears, `cause  he ain't listenin' to you, Cees."
"339","                          GLASS","...to get me to Fort Union. I can sign a draft made good by Captain  Henry."
"340","                          RUNTY MAN","What the fuck happened to your face, boy? You try to slice all  the black off?"
"341","                          TRAPPER #2","Maybe we oughta help him do it  right."
"342","                          FAT TRAPPER","Best get on your way, boy."
"343","                          GLASS","I'm Hugh Glass of the Rocky Mountain Fur Company, and all I  need is..."
"344","                          RUNTY MAN","Do you believe this shit?"
"345","                          FAT TRAPPER","Hell, I warned ya."
"346","                          GLASS","All I need..."
"347","                          GLASS ","...is a horse and enough supplies  to get me to Fort Union."
"348","                          GLASS ","And this shooter here. All made good by Captain Henry and The Rocky  Mountain Fur Company."
"349","                          RUNTY MAN","Shoot him, goddammit!"
"350","                          TRAPPER #2","I can't get a clear look."
"351","                          RUNTY MAN","Shoot `em both!"
"352","                          RUNTY MAN","Get after the son of a bitch!"
"353","                          TRAPPER #2","It's cold as hell, Cees."
"354","                          FAT TRAPPER","And he did say to put it all on the  Rocky Mountain tab."
"355","                          STUBBY BILL","Jesus Christ."
"356","                          BRIDGER","I'm sorry."
"357","                          GLASS","You took everything I had... left  me to die."
"358","                          GLASS ","Why?"
"359","                          BRIDGER","But every day since, I've wished I  had."
"360","                          GLASS","There wasn't no `Ree that night,  was there?"
"361","                          BRIDGER","No."
"362","                          HENRY","Hugh. Wait."
"363","                          GLASS","Where's Fitzgerald and my rifle?"
"364","                          HENRY","Let's get some coffee to warm you up. (to Glass, but looking at BRIDGER)  I wanna hear what happened."
"365","                          BRIDGER","Wait. Please!"
"366","                          GLASS","I cut the shoes loose of her, and  hiked over to Fort Talbot."
"367","                          STUBBY BILL","Christ almighty."
"368","                          GLASS","And you may hear from the fella there about a stoled horse and  supplies charged to you."
"369","                          HENRY","We'll take care of it. You should  go settle in."
"370","                          MURPHY","There's a couple fair whores next door that'll ease the miles on ya,  scars or not."
"371","                          ANDERSON","Jesus, Murph."
"372","                          MURPHY","I just meant I'd go roust one of  `em for ya if you wanted."
"373","                          GLASS","She can take the night off, but I  wouldn't mind the use of her bed."
"374","                          HENRY","Go clear out a room. The rest head  on back to bunk."
"375","                          PIG","I told ya I'd see ya up here. You  remember that, Hugh?"
"376","                          GLASS","I do, Pig. You must have a little  gypsy in ya."
"377","                          PIG","I'll see ya in the mornin'."
"378","                          HENRY","Can I talk you outta what you're  planning?"
"379","                          GLASS","Thank you for what you done for me... stitchin' me back together...  givin' me a chance."
"380","                          HENRY","I'm offerin' you another right now... to stay here... let this  thing go."
"381","                          GLASS","He thinks he let me die. But he don't know that he's the one that's kept me alive... for the chance of findin' him... makin' him pay for  what he done."
"382","                          HENRY","The law will make Fitzgerald pay."
"383","                          GLASS","Do you, Captain?"
"384","                          GLASS ","I thank you for the coffee."
"385","                          MURPHY","He said he was goin' to get his  rifle..."
"386","                          MURPHY ","Your rifle. But he never showed back up. The next day I figured him mighta fell in, but then Pig  seen the canoe was missin'."
"387","                          PIG","And the Captain found the money  gone."
"388","                          GLASS","I'll make my way down river. See  what turns up."
"389","                          STUBBY BILL","The kid's gone... gear and all.  Musta slipped out before light."
"390","                          HENRY","""Every day I think about what I done. I want to tell Pig and the others the truth but am afraid what they'll think of me. I look at Fitzgerald and want to kill him but am afraid to try. I am a coward and wish he hadn't been lyin about the Ree that night. I wish they  had come and kilt us both."""
"391","                          GLASS","If I run across the boy, I'll send  him back your way."
"392","                          GLASS ","Where're you headed?"
"393","                          HENRY","Fitzgerald stole five hundred dollars. Rocky Mountain Fur  Company wants him too."
"394","                          GLASS","I can do this on my own."
"395","                          HENRY","I know you can. But maybe you  won't have to."
"396","                          RUNTY MAN","We ain't got no food to spare, friend, if that's what you're  lookin' for."
"397","                          FITZGERALD","Then what the hell have ya got?"
"398","                          RUNTY MAN","Whiskey and blankets mostly.  Weather's held back deliveries."
"399","                          FITZGERALD","Gimme a couple bottles then. Goddamn ice shredded my boat. Been  walkin' for two days."
"400","                          FITZGERALD ","How much for one of them horses out  there?"
"401","                          RUNTY MAN","Horses ain't cheap this time a  year."
"402","                          FITZGERALD","Whatever the price, Rocky Mountain  Fur Company's good for it."
"403","                          RUNTY MAN","You're the second son of a bitch come in here makin' that claim.  And the first one left a bad taste."
"404","                          FITZGERALD","That right? Well I don't know nothin' about that. Just that I  need a horse."
"405","                          RUNTY MAN","So did this other fella. So he stole one... along with Lange's  pistola."
"406","                          FITZGERALD","Fine then, I'll pay cash for the  horse. How much?"
"407","                          RUNTY MAN","How `bout you pay for your friend's  too."
"408","                          TRAPPER #1","And my shooter."
"409","                          FITZGERALD","Wasn't my friend."
"410","                          TRAPPER #1","Then from where I stand, you don't  got no friends at all."
"411","                          FITZGERALD","Yeah, okay. I'll collect from him.  How much?"
"412","                          RUNTY MAN","How `bout we say eighty... (sees Fitzgerald doesn't ARGUE)  ...five."
"413","                          FITZGERALD","You boys are leavin' me with nothin'. Better be a helluva  horse."
"414","                          RUNTY MAN","Pick of the litter."
"415","                          FITZGERALD","When I see who?"
"416","                          RUNTY MAN","The black son of a bitch that  robbed me. You tell him that."
"417","                          FITZGERALD","Scarred up, you say... and headed  up to Union?"
"418","                          RUNTY MAN","That's what he told us. Seemed  real anxious to get there too."
"419","                          FITZGERALD","I'll make sure to give him the  message when I find him."
"420","                          HENRY","Hugh."
"421","                          HENRY ","That's it."
"422","                          GLASS","Ice tore it up."
"423","                          GLASS ","If the snow holds off, we'll have a  good trail to track."
"424","                          HENRY","What's out that direction? Talbot?"
"425","                          GLASS","And the Missouri. Doubt he'd risk the river with the `Ree. Likely grab a horse, and cross over high... take his chances goin' east against the weather. When'd you  say he skipped out?"
"426","                          HENRY","Three days ago now."
"427","                          GLASS","We best pick up our pace."
"428","                          HENRY","This was Fitzgerald camped here?"
"429","                          GLASS","Couple nights back. But these  tracks aren't all his."
"430","                          HENRY","He's travelin' with somebody?"
"431","                          GLASS","Came in after. Prints are smooth.  Mocassins."
"432","                          GLASS ","Could be Sioux... Blackfoot even."
"433","                          HENRY","But you figure they're `Ree."
"434","                          GLASS","I don't figure nothin', Captain. But whoever it is, they're a good  day behind Fitzgerald."
"435","                          GLASS ","And they're on his trail too, so we should keep it quiet... don't  announce we're back here."
"436","                          HENRY","You told me once you knew enough to  keep away from the `Ree."
"437","                          GLASS","I do."
"438","                          HENRY","You figure this is smart then?"
"439","                          GLASS","You're welcome to head back,  Captain."
"440","                          HENRY","What if we find Fitzgerald... and I  ask you not to do this?"
"441","                          GLASS","Don't ask me."
"442","                          HENRY","`Ree?"
"443","                          HENRY ","There!"
"444","                          GLASS","Wait!"
"445","                          HENRY","So much for stayin' quiet."
"446","                          HENRY","Guess you would've been better off  on your own."
"447","                          GLASS","We needed to pick up some time  anyways."
"448","                          HENRY","Whatta ya got?"
"449","                          GLASS","Smoke."
"450","                          GLASS ","I'll head in from the west... you  take the east."
"451","                          HENRY","What if it's `Ree?"
"452","                          GLASS","Then we leave `em be... meet back  up here."
"453","                          FITZGERALD","Didn't figure an important man like you to be away from your stove on a night as cold as this, Captain.  You lost?"
"454","                          HENRY","I'm here to save your life."
"455","                          FITZGERALD","I done told you boys... I don't  need savin' by you or nobody else."
"456","                          GLASS","You shouldn't a come."
"457","                          GLASS ","(repeating Spotted Horse's words under his breath) Arikara take right ear of Sioux. Left ear of whites. Not know what  they take from you."
"458","                          FITZGERALD","Glass... please!"
"459","                          GLASS","I am Tatanka Wicasa! I have killed whites and I have killed Arikara and I have killed grizzly! AND I  WILL KILL YOU!"
"460","                          GLASS ","COME ON!"
